{
  "$schema": "https://json-schema.org/draft/2020-12/schema",
  "$id": "https://linktrend.local/linksites/ls11/checksums.schema.json",
  "title": "LS-11 scaffolding checksums",
  "type": "object",
  "additionalProperties": false,
  "required": [
    "schemaVersion",
    "kind",
    "algorithm",
    "packetId",
    "githubIssue",
    "protectedDevelopment",
    "packageDigest",
    "files"
  ],
  "properties": {
    "schemaVersion": { "const": 1 },
    "kind": { "const": "ls11-release-checksums" },
    "algorithm": { "const": "sha256" },
    "packetId": { "const": "LS-11" },
    "githubIssue": { "const": 361 },
    "protectedDevelopment": {
      "type": "object",
      "additionalProperties": false,
      "required": ["commit", "tree"],
      "properties": {
        "commit": { "const": "d5056f8e4ce832a759fda18f8b3282eba170b471" },
        "tree": { "const": "3358c4ae4e33143799b301aa5c34f498f6a3d7ac" }
      }
    },
    "packageDigest": {
      "type": "string",
      "pattern": "^sha256:[0-9a-f]{64}$"
    },
    "files": {
      "type": "array",
      "minItems": 1,
      "items": {
        "type": "object",
        "additionalProperties": false,
        "required": ["path", "sha256"],
        "properties": {
          "path": { "type": "string", "minLength": 1 },
          "sha256": { "type": "string", "pattern": "^[0-9a-f]{64}$" }
        }
      }
    }
  }
}
